This is a wiimote EEPROM dump using the 0x04 flag in READ_MEM requests. One byte
is read per request.

0x00000000: 0x88 0x85 0x8b 0x8b 0x8a 0x97 0x3f 0x30
0x00000008: 0x8c 0x39 0xcd 0x88 0x85 0x8b 0x8b 0x8a
0x00000010: 0x97 0x3f 0x30 0x8c 0x39 0xcd 0x84 0x82
0x00000018: 0x86 0x30 0x9f 0x9d 0x9f 0x02 0x40 0x2e
0x00000020: 0x84 0x82 0x86 0x30 0x9f 0x9d 0x9f 0x02
0x00000028: 0x40 0x2e 0x00 0x00 0x00 0x00 0x00 0x00
0x00000030: 0x00 0x00 0x00 0x00 0x00 0x00 0x00 0x00
0x00000038: 0x00 0x00 0x00 0x00 0x00 0x00 0x00 0x00
0x00000040: 0x00 0x00 0x00 0x00 0x00 0x00 0x00 0x00
0x00000048: 0x00 0x00 0x00 0x00 0x00 0x00 0x00 0x00
0x00000050: 0x00 0x00 0x00 0x00 0x00 0x00 0x00 0x00
0x00000058: 0x00 0x00 0x00 0x00 0x00 0x00 0x00 0x00
0x00000060: 0x00 0x00 0x00 0x00 0x00 0x00 0x00 0x00
0x00000068: 0x00 0x00 0x00 0x00 0x00 0x00 0x00 0x00
0x00000070: 0x00 0x00 0x00 0x00 0x00 0x00 0x00 0x00
0x00000078: 0x00 0x00 0x00 0x00 0x00 0x00 0x00 0x00
0x00000080: 0x00 0x00 0x00 0x00 0x00 0x00 0x00 0x00
0x00000088: 0x00 0x00 0x00 0x00 0x00 0x00 0x00 0x00
0x00000090: 0x00 0x00 0x00 0x00 0x00 0x00 0x00 0x00
0x00000098: 0x00 0x00 0x00 0x00 0x00 0x00 0x00 0x00
0x000000a0: 0x00 0x00 0x00 0x00 0x00 0x00 0x00 0x00
0x000000a8: 0x00 0x00 0x00 0x00 0x00 0x00 0x00 0x00
0x000000b0: 0x00 0x00 0x00 0x00 0x00 0x00 0x00 0x00
0x000000b8: 0x00 0x00 0x00 0x00 0x00 0x00 0x00 0x00
0x000000c0: 0x00 0x00 0x00 0x00 0x00 0x00 0x00 0x00
0x000000c8: 0x00 0x00 0x00 0x00 0x00 0x00 0x00 0x00
0x000000d0: 0x00 0x00 0x00 0x00 0x00 0x00 0x00 0x00
0x000000d8: 0x00 0x00 0x00 0x00 0x00 0x00 0x00 0x00
0x000000e0: 0x00 0x00 0x00 0x00 0x00 0x00 0x00 0x00
0x000000e8: 0x00 0x00 0x00 0x00 0x00 0x00 0x00 0x00
0x000000f0: 0x00 0x00 0x00 0x00 0x00 0x00 0x00 0x00
0x000000f8: 0x00 0x00 0x00 0x00 0x00 0x00 0x00 0x00
0x00000100: 0x00 0x00 0x00 0x00 0x00 0x00 0x00 0x00
0x00000108: 0x00 0x00 0x00 0x00 0x00 0x00 0x00 0x00
0x00000110: 0x00 0x00 0x00 0x00 0x00 0x00 0x00 0x00
0x00000118: 0x00 0x00 0x00 0x00 0x00 0x00 0x00 0x00
0x00000120: 0x00 0x00 0x00 0x00 0x00 0x00 0x00 0x00
0x00000128: 0x00 0x00 0x00 0x00 0x00 0x00 0x00 0x00
0x00000130: 0x00 0x00 0x00 0x00 0x00 0x00 0x00 0x00
0x00000138: 0x00 0x00 0x00 0x00 0x00 0x00 0x00 0x00
0x00000140: 0x00 0x00 0x00 0x00 0x00 0x00 0x00 0x00
0x00000148: 0x00 0x00 0x00 0x00 0x00 0x00 0x00 0x00
0x00000150: 0x00 0x00 0x00 0x00 0x00 0x00 0x00 0x00
0x00000158: 0x00 0x00 0x00 0x00 0x00 0x00 0x00 0x00
0x00000160: 0x00 0x00 0x00 0x00 0x00 0x00 0x00 0x00
0x00000168: 0x00 0x00 0x00 0x00 0x00 0x00 0x00 0x00
0x00000170: 0x00 0x00 0x00 0x00 0x00 0x00 0x00 0x00
0x00000178: 0x00 0x00 0x00 0x00 0x00 0x00 0x00 0x00
0x00000180: 0x00 0x00 0x00 0x00 0x00 0x00 0x00 0x00
0x00000188: 0x00 0x00 0x00 0x00 0x00 0x00 0x00 0x00
0x00000190: 0x00 0x00 0x00 0x00 0x00 0x00 0x00 0x00
0x00000198: 0x00 0x00 0x00 0x00 0x00 0x00 0x00 0x00
0x000001a0: 0x00 0x00 0x00 0x00 0x00 0x00 0x00 0x00
0x000001a8: 0x00 0x00 0x00 0x00 0x00 0x00 0x00 0x00
0x000001b0: 0x00 0x00 0x00 0x00 0x00 0x00 0x00 0x00
0x000001b8: 0x00 0x00 0x00 0x00 0x00 0x00 0x00 0x00
0x000001c0: 0x00 0x00 0x00 0x00 0x00 0x00 0x00 0x00
0x000001c8: 0x00 0x00 0x00 0x00 0x00 0x00 0x00 0x00
0x000001d0: 0x00 0x00 0x00 0x00 0x00 0x00 0x00 0x00
0x000001d8: 0x00 0x00 0x00 0x00 0x00 0x00 0x00 0x00
0x000001e0: 0x00 0x00 0x00 0x00 0x00 0x00 0x00 0x00
0x000001e8: 0x00 0x00 0x00 0x00 0x00 0x00 0x00 0x00
0x000001f0: 0x00 0x00 0x00 0x00 0x00 0x00 0x00 0x00
0x000001f8: 0x00 0x00 0x00 0x00 0x00 0x00 0x00 0x00
0x00000200: 0x00 0x00 0x00 0x00 0x00 0x00 0x00 0x00
0x00000208: 0x00 0x00 0x00 0x00 0x00 0x00 0x00 0x00
0x00000210: 0x00 0x00 0x00 0x00 0x00 0x00 0x00 0x00
0x00000218: 0x00 0x00 0x00 0x00 0x00 0x00 0x00 0x00
0x00000220: 0x00 0x00 0x00 0x00 0x00 0x00 0x00 0x00
0x00000228: 0x00 0x00 0x00 0x00 0x00 0x00 0x00 0x00
0x00000230: 0x00 0x00 0x00 0x00 0x00 0x00 0x00 0x00
0x00000238: 0x00 0x00 0x00 0x00 0x00 0x00 0x00 0x00
0x00000240: 0x00 0x00 0x00 0x00 0x00 0x00 0x00 0x00
0x00000248: 0x00 0x00 0x00 0x00 0x00 0x00 0x00 0x00
0x00000250: 0x00 0x00 0x00 0x00 0x00 0x00 0x00 0x00
0x00000258: 0x00 0x00 0x00 0x00 0x00 0x00 0x00 0x00
0x00000260: 0x00 0x00 0x00 0x00 0x00 0x00 0x00 0x00
0x00000268: 0x00 0x00 0x00 0x00 0x00 0x00 0x00 0x00
0x00000270: 0x00 0x00 0x00 0x00 0x00 0x00 0x00 0x00
0x00000278: 0x00 0x00 0x00 0x00 0x00 0x00 0x00 0x00
0x00000280: 0x00 0x00 0x00 0x00 0x00 0x00 0x00 0x00
0x00000288: 0x00 0x00 0x00 0x00 0x00 0x00 0x00 0x00
0x00000290: 0x00 0x00 0x00 0x00 0x00 0x00 0x00 0x00
0x00000298: 0x00 0x00 0x00 0x00 0x00 0x00 0x00 0x00
0x000002a0: 0x00 0x00 0x00 0x00 0x00 0x00 0x00 0x00
0x000002a8: 0x00 0x00 0x00 0x00 0x00 0x00 0x00 0x00
0x000002b0: 0x00 0x00 0x00 0x00 0x00 0x00 0x00 0x00
0x000002b8: 0x00 0x00 0x00 0x00 0x00 0x00 0x00 0x00
0x000002c0: 0x00 0x00 0x00 0x00 0x00 0x00 0x00 0x00
0x000002c8: 0x00 0x00 0x00 0x00 0x00 0x00 0x00 0x00
0x000002d0: 0x00 0x00 0x00 0x00 0x00 0x00 0x00 0x00
0x000002d8: 0x00 0x00 0x00 0x00 0x00 0x00 0x00 0x00
0x000002e0: 0x00 0x00 0x00 0x00 0x00 0x00 0x00 0x00
0x000002e8: 0x00 0x00 0x00 0x00 0x00 0x00 0x00 0x00
0x000002f0: 0x00 0x00 0x00 0x00 0x00 0x00 0x00 0x00
0x000002f8: 0x00 0x00 0x00 0x00 0x00 0x00 0x00 0x00
0x00000300: 0x00 0x00 0x00 0x00 0x00 0x00 0x00 0x00
0x00000308: 0x00 0x00 0x00 0x00 0x00 0x00 0x00 0x00
0x00000310: 0x00 0x00 0x00 0x00 0x00 0x00 0x00 0x00
0x00000318: 0x00 0x00 0x00 0x00 0x00 0x00 0x00 0x00
0x00000320: 0x00 0x00 0x00 0x00 0x00 0x00 0x00 0x00
0x00000328: 0x00 0x00 0x00 0x00 0x00 0x00 0x00 0x00
0x00000330: 0x00 0x00 0x00 0x00 0x00 0x00 0x00 0x00
0x00000338: 0x00 0x00 0x00 0x00 0x00 0x00 0x00 0x00
0x00000340: 0x00 0x00 0x00 0x00 0x00 0x00 0x00 0x00
0x00000348: 0x00 0x00 0x00 0x00 0x00 0x00 0x00 0x00
0x00000350: 0x00 0x00 0x00 0x00 0x00 0x00 0x00 0x00
0x00000358: 0x00 0x00 0x00 0x00 0x00 0x00 0x00 0x00
0x00000360: 0x00 0x00 0x00 0x00 0x00 0x00 0x00 0x00
0x00000368: 0x00 0x00 0x00 0x00 0x00 0x00 0x00 0x00
0x00000370: 0x00 0x00 0x00 0x00 0x00 0x00 0x00 0x00
0x00000378: 0x00 0x00 0x00 0x00 0x00 0x00 0x00 0x00
0x00000380: 0x00 0x00 0x00 0x00 0x00 0x00 0x00 0x00
0x00000388: 0x00 0x00 0x00 0x00 0x00 0x00 0x00 0x00
0x00000390: 0x00 0x00 0x00 0x00 0x00 0x00 0x00 0x00
0x00000398: 0x00 0x00 0x00 0x00 0x00 0x00 0x00 0x00
0x000003a0: 0x00 0x00 0x00 0x00 0x00 0x00 0x00 0x00
0x000003a8: 0x00 0x00 0x00 0x00 0x00 0x00 0x00 0x00
0x000003b0: 0x00 0x00 0x00 0x00 0x00 0x00 0x00 0x00
0x000003b8: 0x00 0x00 0x00 0x00 0x00 0x00 0x00 0x00
0x000003c0: 0x00 0x00 0x00 0x00 0x00 0x00 0x00 0x00
0x000003c8: 0x00 0x00 0x00 0x00 0x00 0x00 0x00 0x00
0x000003d0: 0x00 0x00 0x00 0x00 0x00 0x00 0x00 0x00
0x000003d8: 0x00 0x00 0x00 0x00 0x00 0x00 0x00 0x00
0x000003e0: 0x00 0x00 0x00 0x00 0x00 0x00 0x00 0x00
0x000003e8: 0x00 0x00 0x00 0x00 0x00 0x00 0x00 0x00
0x000003f0: 0x00 0x00 0x00 0x00 0x00 0x00 0x00 0x00
0x000003f8: 0x00 0x00 0x00 0x00 0x00 0x00 0x00 0x00
0x00000400: 0x00 0x00 0x00 0x00 0x00 0x00 0x00 0x00
0x00000408: 0x00 0x00 0x00 0x00 0x00 0x00 0x00 0x00
0x00000410: 0x00 0x00 0x00 0x00 0x00 0x00 0x00 0x00
0x00000418: 0x00 0x00 0x00 0x00 0x00 0x00 0x00 0x00
0x00000420: 0x00 0x00 0x00 0x00 0x00 0x00 0x00 0x00
0x00000428: 0x00 0x00 0x00 0x00 0x00 0x00 0x00 0x00
0x00000430: 0x00 0x00 0x00 0x00 0x00 0x00 0x00 0x00
0x00000438: 0x00 0x00 0x00 0x00 0x00 0x00 0x00 0x00
0x00000440: 0x00 0x00 0x00 0x00 0x00 0x00 0x00 0x00
0x00000448: 0x00 0x00 0x00 0x00 0x00 0x00 0x00 0x00
0x00000450: 0x00 0x00 0x00 0x00 0x00 0x00 0x00 0x00
0x00000458: 0x00 0x00 0x00 0x00 0x00 0x00 0x00 0x00
0x00000460: 0x00 0x00 0x00 0x00 0x00 0x00 0x00 0x00
0x00000468: 0x00 0x00 0x00 0x00 0x00 0x00 0x00 0x00
0x00000470: 0x00 0x00 0x00 0x00 0x00 0x00 0x00 0x00
0x00000478: 0x00 0x00 0x00 0x00 0x00 0x00 0x00 0x00
0x00000480: 0x00 0x00 0x00 0x00 0x00 0x00 0x00 0x00
0x00000488: 0x00 0x00 0x00 0x00 0x00 0x00 0x00 0x00
0x00000490: 0x00 0x00 0x00 0x00 0x00 0x00 0x00 0x00
0x00000498: 0x00 0x00 0x00 0x00 0x00 0x00 0x00 0x00
0x000004a0: 0x00 0x00 0x00 0x00 0x00 0x00 0x00 0x00
0x000004a8: 0x00 0x00 0x00 0x00 0x00 0x00 0x00 0x00
0x000004b0: 0x00 0x00 0x00 0x00 0x00 0x00 0x00 0x00
0x000004b8: 0x00 0x00 0x00 0x00 0x00 0x00 0x00 0x00
0x000004c0: 0x00 0x00 0x00 0x00 0x00 0x00 0x00 0x00
0x000004c8: 0x00 0x00 0x00 0x00 0x00 0x00 0x00 0x00
0x000004d0: 0x00 0x00 0x00 0x00 0x00 0x00 0x00 0x00
0x000004d8: 0x00 0x00 0x00 0x00 0x00 0x00 0x00 0x00
0x000004e0: 0x00 0x00 0x00 0x00 0x00 0x00 0x00 0x00
0x000004e8: 0x00 0x00 0x00 0x00 0x00 0x00 0x00 0x00
0x000004f0: 0x00 0x00 0x00 0x00 0x00 0x00 0x00 0x00
0x000004f8: 0x00 0x00 0x00 0x00 0x00 0x00 0x00 0x00
0x00000500: 0x00 0x00 0x00 0x00 0x00 0x00 0x00 0x00
0x00000508: 0x00 0x00 0x00 0x00 0x00 0x00 0x00 0x00
0x00000510: 0x00 0x00 0x00 0x00 0x00 0x00 0x00 0x00
0x00000518: 0x00 0x00 0x00 0x00 0x00 0x00 0x00 0x00
0x00000520: 0x00 0x00 0x00 0x00 0x00 0x00 0x00 0x00
0x00000528: 0x00 0x00 0x00 0x00 0x00 0x00 0x00 0x00
0x00000530: 0x00 0x00 0x00 0x00 0x00 0x00 0x00 0x00
0x00000538: 0x00 0x00 0x00 0x00 0x00 0x00 0x00 0x00
0x00000540: 0x00 0x00 0x00 0x00 0x00 0x00 0x00 0x00
0x00000548: 0x00 0x00 0x00 0x00 0x00 0x00 0x00 0x00
0x00000550: 0x00 0x00 0x00 0x00 0x00 0x00 0x00 0x00
0x00000558: 0x00 0x00 0x00 0x00 0x00 0x00 0x00 0x00
0x00000560: 0x00 0x00 0x00 0x00 0x00 0x00 0x00 0x00
0x00000568: 0x00 0x00 0x00 0x00 0x00 0x00 0x00 0x00
0x00000570: 0x00 0x00 0x00 0x00 0x00 0x00 0x00 0x00
0x00000578: 0x00 0x00 0x00 0x00 0x00 0x00 0x00 0x00
0x00000580: 0x00 0x00 0x00 0x00 0x00 0x00 0x00 0x00
0x00000588: 0x00 0x00 0x00 0x00 0x00 0x00 0x00 0x00
0x00000590: 0x00 0x00 0x00 0x00 0x00 0x00 0x00 0x00
0x00000598: 0x00 0x00 0x00 0x00 0x00 0x00 0x00 0x00
0x000005a0: 0x00 0x00 0x00 0x00 0x00 0x00 0x00 0x00
0x000005a8: 0x00 0x00 0x00 0x00 0x00 0x00 0x00 0x00
0x000005b0: 0x00 0x00 0x00 0x00 0x00 0x00 0x00 0x00
0x000005b8: 0x00 0x00 0x00 0x00 0x00 0x00 0x00 0x00
0x000005c0: 0x00 0x00 0x00 0x00 0x00 0x00 0x00 0x00
0x000005c8: 0x00 0x00 0x00 0x00 0x00 0x00 0x00 0x00
0x000005d0: 0x00 0x00 0x00 0x00 0x00 0x00 0x00 0x00
0x000005d8: 0x00 0x00 0x00 0x00 0x00 0x00 0x00 0x00
0x000005e0: 0x00 0x00 0x00 0x00 0x00 0x00 0x00 0x00
0x000005e8: 0x00 0x00 0x00 0x00 0x00 0x00 0x00 0x00
0x000005f0: 0x00 0x00 0x00 0x00 0x00 0x00 0x00 0x00
0x000005f8: 0x00 0x00 0x00 0x00 0x00 0x00 0x00 0x00
0x00000600: 0x00 0x00 0x00 0x00 0x00 0x00 0x00 0x00
0x00000608: 0x00 0x00 0x00 0x00 0x00 0x00 0x00 0x00
0x00000610: 0x00 0x00 0x00 0x00 0x00 0x00 0x00 0x00
0x00000618: 0x00 0x00 0x00 0x00 0x00 0x00 0x00 0x00
0x00000620: 0x00 0x00 0x00 0x00 0x00 0x00 0x00 0x00
0x00000628: 0x00 0x00 0x00 0x00 0x00 0x00 0x00 0x00
0x00000630: 0x00 0x00 0x00 0x00 0x00 0x00 0x00 0x00
0x00000638: 0x00 0x00 0x00 0x00 0x00 0x00 0x00 0x00
0x00000640: 0x00 0x00 0x00 0x00 0x00 0x00 0x00 0x00
0x00000648: 0x00 0x00 0x00 0x00 0x00 0x00 0x00 0x00
0x00000650: 0x00 0x00 0x00 0x00 0x00 0x00 0x00 0x00
0x00000658: 0x00 0x00 0x00 0x00 0x00 0x00 0x00 0x00
0x00000660: 0x00 0x00 0x00 0x00 0x00 0x00 0x00 0x00
0x00000668: 0x00 0x00 0x00 0x00 0x00 0x00 0x00 0x00
0x00000670: 0x00 0x00 0x00 0x00 0x00 0x00 0x00 0x00
0x00000678: 0x00 0x00 0x00 0x00 0x00 0x00 0x00 0x00
0x00000680: 0x00 0x00 0x00 0x00 0x00 0x00 0x00 0x00
0x00000688: 0x00 0x00 0x00 0x00 0x00 0x00 0x00 0x00
0x00000690: 0x00 0x00 0x00 0x00 0x00 0x00 0x00 0x00
0x00000698: 0x00 0x00 0x00 0x00 0x00 0x00 0x00 0x00
0x000006a0: 0x00 0x00 0x00 0x00 0x00 0x00 0x00 0x00
0x000006a8: 0x00 0x00 0x00 0x00 0x00 0x00 0x00 0x00
0x000006b0: 0x00 0x00 0x00 0x00 0x00 0x00 0x00 0x00
0x000006b8: 0x00 0x00 0x00 0x00 0x00 0x00 0x00 0x00
0x000006c0: 0x00 0x00 0x00 0x00 0x00 0x00 0x00 0x00
0x000006c8: 0x00 0x00 0x00 0x00 0x00 0x00 0x00 0x00
0x000006d0: 0x00 0x00 0x00 0x00 0x00 0x00 0x00 0x00
0x000006d8: 0x00 0x00 0x00 0x00 0x00 0x00 0x00 0x00
0x000006e0: 0x00 0x00 0x00 0x00 0x00 0x00 0x00 0x00
0x000006e8: 0x00 0x00 0x00 0x00 0x00 0x00 0x00 0x00
0x000006f0: 0x00 0x00 0x00 0x00 0x00 0x00 0x00 0x00
0x000006f8: 0x00 0x00 0x00 0x00 0x00 0x00 0x00 0x00
0x00000700: 0x00 0x00 0x00 0x00 0x00 0x00 0x00 0x00
0x00000708: 0x00 0x00 0x00 0x00 0x00 0x00 0x00 0x00
0x00000710: 0x00 0x00 0x00 0x00 0x00 0x00 0x00 0x00
0x00000718: 0x00 0x00 0x00 0x00 0x00 0x00 0x00 0x00
0x00000720: 0x00 0x00 0x00 0x00 0x00 0x00 0x00 0x00
0x00000728: 0x00 0x00 0x00 0x00 0x00 0x00 0x00 0x00
0x00000730: 0x00 0x00 0x00 0x00 0x00 0x00 0x00 0x00
0x00000738: 0x00 0x00 0x00 0x00 0x00 0x00 0x00 0x00
0x00000740: 0x00 0x00 0x00 0x00 0x00 0x00 0x00 0x00
0x00000748: 0x00 0x00 0x00 0x00 0x00 0x00 0x00 0x00
0x00000750: 0x00 0x00 0x00 0x00 0x00 0x00 0x00 0x00
0x00000758: 0x00 0x00 0x00 0x00 0x00 0x00 0x00 0x00
0x00000760: 0x00 0x00 0x00 0x00 0x00 0x00 0x00 0x00
0x00000768: 0x00 0x00 0x00 0x00 0x00 0x00 0x00 0x00
0x00000770: 0x00 0x00 0x00 0x00 0x00 0x00 0x00 0x00
0x00000778: 0x00 0x00 0x00 0x00 0x00 0x00 0x00 0x00
0x00000780: 0x00 0x00 0x00 0x00 0x00 0x00 0x00 0x00
0x00000788: 0x00 0x00 0x00 0x00 0x00 0x00 0x00 0x00
0x00000790: 0x00 0x00 0x00 0x00 0x00 0x00 0x00 0x00
0x00000798: 0x00 0x00 0x00 0x00 0x00 0x00 0x00 0x00
0x000007a0: 0x00 0x00 0x00 0x00 0x00 0x00 0x00 0x00
0x000007a8: 0x00 0x00 0x00 0x00 0x00 0x00 0x00 0x00
0x000007b0: 0x00 0x00 0x00 0x00 0x00 0x00 0x00 0x00
0x000007b8: 0x00 0x00 0x00 0x00 0x00 0x00 0x00 0x00
0x000007c0: 0x00 0x00 0x00 0x00 0x00 0x00 0x00 0x00
0x000007c8: 0x00 0x00 0x00 0x00 0x00 0x00 0x00 0x00
0x000007d0: 0x00 0x00 0x00 0x00 0x00 0x00 0x00 0x00
0x000007d8: 0x00 0x00 0x00 0x00 0x00 0x00 0x00 0x00
0x000007e0: 0x00 0x00 0x00 0x00 0x00 0x00 0x00 0x00
0x000007e8: 0x00 0x00 0x00 0x00 0x00 0x00 0x00 0x00
0x000007f0: 0x00 0x00 0x00 0x00 0x00 0x00 0x00 0x00
0x000007f8: 0x00 0x00 0x00 0x00 0x00 0x00 0x00 0x00
0x00000800: 0x00 0x00 0x00 0x00 0x00 0x00 0x00 0x00
0x00000808: 0x00 0x00 0x00 0x00 0x00 0x00 0x00 0x00
0x00000810: 0x00 0x00 0x00 0x00 0x00 0x00 0x00 0x00
0x00000818: 0x00 0x00 0x00 0x00 0x00 0x00 0x00 0x00
0x00000820: 0x00 0x00 0x00 0x00 0x00 0x00 0x00 0x00
0x00000828: 0x00 0x00 0x00 0x00 0x00 0x00 0x00 0x00
0x00000830: 0x00 0x00 0x00 0x00 0x00 0x00 0x00 0x00
0x00000838: 0x00 0x00 0x00 0x00 0x00 0x00 0x00 0x00
0x00000840: 0x00 0x00 0x00 0x00 0x00 0x00 0x00 0x00
0x00000848: 0x00 0x00 0x00 0x00 0x00 0x00 0x00 0x00
0x00000850: 0x00 0x00 0x00 0x00 0x00 0x00 0x00 0x00
0x00000858: 0x00 0x00 0x00 0x00 0x00 0x00 0x00 0x00
0x00000860: 0x00 0x00 0x00 0x00 0x00 0x00 0x00 0x00
0x00000868: 0x00 0x00 0x00 0x00 0x00 0x00 0x00 0x00
0x00000870: 0x00 0x00 0x00 0x00 0x00 0x00 0x00 0x00
0x00000878: 0x00 0x00 0x00 0x00 0x00 0x00 0x00 0x00
0x00000880: 0x00 0x00 0x00 0x00 0x00 0x00 0x00 0x00
0x00000888: 0x00 0x00 0x00 0x00 0x00 0x00 0x00 0x00
0x00000890: 0x00 0x00 0x00 0x00 0x00 0x00 0x00 0x00
0x00000898: 0x00 0x00 0x00 0x00 0x00 0x00 0x00 0x00
0x000008a0: 0x00 0x00 0x00 0x00 0x00 0x00 0x00 0x00
0x000008a8: 0x00 0x00 0x00 0x00 0x00 0x00 0x00 0x00
0x000008b0: 0x00 0x00 0x00 0x00 0x00 0x00 0x00 0x00
0x000008b8: 0x00 0x00 0x00 0x00 0x00 0x00 0x00 0x00
0x000008c0: 0x00 0x00 0x00 0x00 0x00 0x00 0x00 0x00
0x000008c8: 0x00 0x00 0x00 0x00 0x00 0x00 0x00 0x00
0x000008d0: 0x00 0x00 0x00 0x00 0x00 0x00 0x00 0x00
0x000008d8: 0x00 0x00 0x00 0x00 0x00 0x00 0x00 0x00
0x000008e0: 0x00 0x00 0x00 0x00 0x00 0x00 0x00 0x00
0x000008e8: 0x00 0x00 0x00 0x00 0x00 0x00 0x00 0x00
0x000008f0: 0x00 0x00 0x00 0x00 0x00 0x00 0x00 0x00
0x000008f8: 0x00 0x00 0x00 0x00 0x00 0x00 0x00 0x00
0x00000900: 0x00 0x00 0x00 0x00 0x00 0x00 0x00 0x00
0x00000908: 0x00 0x00 0x00 0x00 0x00 0x00 0x00 0x00
0x00000910: 0x00 0x00 0x00 0x00 0x00 0x00 0x00 0x00
0x00000918: 0x00 0x00 0x00 0x00 0x00 0x00 0x00 0x00
0x00000920: 0x00 0x00 0x00 0x00 0x00 0x00 0x00 0x00
0x00000928: 0x00 0x00 0x00 0x00 0x00 0x00 0x00 0x00
0x00000930: 0x00 0x00 0x00 0x00 0x00 0x00 0x00 0x00
0x00000938: 0x00 0x00 0x00 0x00 0x00 0x00 0x00 0x00
0x00000940: 0x00 0x00 0x00 0x00 0x00 0x00 0x00 0x00
0x00000948: 0x00 0x00 0x00 0x00 0x00 0x00 0x00 0x00
0x00000950: 0x00 0x00 0x00 0x00 0x00 0x00 0x00 0x00
0x00000958: 0x00 0x00 0x00 0x00 0x00 0x00 0x00 0x00
0x00000960: 0x00 0x00 0x00 0x00 0x00 0x00 0x00 0x00
0x00000968: 0x00 0x00 0x00 0x00 0x00 0x00 0x00 0x00
0x00000970: 0x00 0x00 0x00 0x00 0x00 0x00 0x00 0x00
0x00000978: 0x00 0x00 0x00 0x00 0x00 0x00 0x00 0x00
0x00000980: 0x00 0x00 0x00 0x00 0x00 0x00 0x00 0x00
0x00000988: 0x00 0x00 0x00 0x00 0x00 0x00 0x00 0x00
0x00000990: 0x00 0x00 0x00 0x00 0x00 0x00 0x00 0x00
0x00000998: 0x00 0x00 0x00 0x00 0x00 0x00 0x00 0x00
0x000009a0: 0x00 0x00 0x00 0x00 0x00 0x00 0x00 0x00
0x000009a8: 0x00 0x00 0x00 0x00 0x00 0x00 0x00 0x00
0x000009b0: 0x00 0x00 0x00 0x00 0x00 0x00 0x00 0x00
0x000009b8: 0x00 0x00 0x00 0x00 0x00 0x00 0x00 0x00
0x000009c0: 0x00 0x00 0x00 0x00 0x00 0x00 0x00 0x00
0x000009c8: 0x00 0x00 0x00 0x00 0x00 0x00 0x00 0x00
0x000009d0: 0x00 0x00 0x00 0x00 0x00 0x00 0x00 0x00
0x000009d8: 0x00 0x00 0x00 0x00 0x00 0x00 0x00 0x00
0x000009e0: 0x00 0x00 0x00 0x00 0x00 0x00 0x00 0x00
0x000009e8: 0x00 0x00 0x00 0x00 0x00 0x00 0x00 0x00
0x000009f0: 0x00 0x00 0x00 0x00 0x00 0x00 0x00 0x00
0x000009f8: 0x00 0x00 0x00 0x00 0x00 0x00 0x00 0x00
0x00000a00: 0x00 0x00 0x00 0x00 0x00 0x00 0x00 0x00
0x00000a08: 0x00 0x00 0x00 0x00 0x00 0x00 0x00 0x00
0x00000a10: 0x00 0x00 0x00 0x00 0x00 0x00 0x00 0x00
0x00000a18: 0x00 0x00 0x00 0x00 0x00 0x00 0x00 0x00
0x00000a20: 0x00 0x00 0x00 0x00 0x00 0x00 0x00 0x00
0x00000a28: 0x00 0x00 0x00 0x00 0x00 0x00 0x00 0x00
0x00000a30: 0x00 0x00 0x00 0x00 0x00 0x00 0x00 0x00
0x00000a38: 0x00 0x00 0x00 0x00 0x00 0x00 0x00 0x00
0x00000a40: 0x00 0x00 0x00 0x00 0x00 0x00 0x00 0x00
0x00000a48: 0x00 0x00 0x00 0x00 0x00 0x00 0x00 0x00
0x00000a50: 0x00 0x00 0x00 0x00 0x00 0x00 0x00 0x00
0x00000a58: 0x00 0x00 0x00 0x00 0x00 0x00 0x00 0x00
0x00000a60: 0x00 0x00 0x00 0x00 0x00 0x00 0x00 0x00
0x00000a68: 0x00 0x00 0x00 0x00 0x00 0x00 0x00 0x00
0x00000a70: 0x00 0x00 0x00 0x00 0x00 0x00 0x00 0x00
0x00000a78: 0x00 0x00 0x00 0x00 0x00 0x00 0x00 0x00
0x00000a80: 0x00 0x00 0x00 0x00 0x00 0x00 0x00 0x00
0x00000a88: 0x00 0x00 0x00 0x00 0x00 0x00 0x00 0x00
0x00000a90: 0x00 0x00 0x00 0x00 0x00 0x00 0x00 0x00
0x00000a98: 0x00 0x00 0x00 0x00 0x00 0x00 0x00 0x00
0x00000aa0: 0x00 0x00 0x00 0x00 0x00 0x00 0x00 0x00
0x00000aa8: 0x00 0x00 0x00 0x00 0x00 0x00 0x00 0x00
0x00000ab0: 0x00 0x00 0x00 0x00 0x00 0x00 0x00 0x00
0x00000ab8: 0x00 0x00 0x00 0x00 0x00 0x00 0x00 0x00
0x00000ac0: 0x00 0x00 0x00 0x00 0x00 0x00 0x00 0x00
0x00000ac8: 0x00 0x00 0x00 0x00 0x00 0x00 0x00 0x00
0x00000ad0: 0x00 0x00 0x00 0x00 0x00 0x00 0x00 0x00
0x00000ad8: 0x00 0x00 0x00 0x00 0x00 0x00 0x00 0x00
0x00000ae0: 0x00 0x00 0x00 0x00 0x00 0x00 0x00 0x00
0x00000ae8: 0x00 0x00 0x00 0x00 0x00 0x00 0x00 0x00
0x00000af0: 0x00 0x00 0x00 0x00 0x00 0x00 0x00 0x00
0x00000af8: 0x00 0x00 0x00 0x00 0x00 0x00 0x00 0x00
0x00000b00: 0x00 0x00 0x00 0x00 0x00 0x00 0x00 0x00
0x00000b08: 0x00 0x00 0x00 0x00 0x00 0x00 0x00 0x00
0x00000b10: 0x00 0x00 0x00 0x00 0x00 0x00 0x00 0x00
0x00000b18: 0x00 0x00 0x00 0x00 0x00 0x00 0x00 0x00
0x00000b20: 0x00 0x00 0x00 0x00 0x00 0x00 0x00 0x00
0x00000b28: 0x00 0x00 0x00 0x00 0x00 0x00 0x00 0x00
0x00000b30: 0x00 0x00 0x00 0x00 0x00 0x00 0x00 0x00
0x00000b38: 0x00 0x00 0x00 0x00 0x00 0x00 0x00 0x00
0x00000b40: 0x00 0x00 0x00 0x00 0x00 0x00 0x00 0x00
0x00000b48: 0x00 0x00 0x00 0x00 0x00 0x00 0x00 0x00
0x00000b50: 0x00 0x00 0x00 0x00 0x00 0x00 0x00 0x00
0x00000b58: 0x00 0x00 0x00 0x00 0x00 0x00 0x00 0x00
0x00000b60: 0x00 0x00 0x00 0x00 0x00 0x00 0x00 0x00
0x00000b68: 0x00 0x00 0x00 0x00 0x00 0x00 0x00 0x00
0x00000b70: 0x00 0x00 0x00 0x00 0x00 0x00 0x00 0x00
0x00000b78: 0x00 0x00 0x00 0x00 0x00 0x00 0x00 0x00
0x00000b80: 0x00 0x00 0x00 0x00 0x00 0x00 0x00 0x00
0x00000b88: 0x00 0x00 0x00 0x00 0x00 0x00 0x00 0x00
0x00000b90: 0x00 0x00 0x00 0x00 0x00 0x00 0x00 0x00
0x00000b98: 0x00 0x00 0x00 0x00 0x00 0x00 0x00 0x00
0x00000ba0: 0x00 0x00 0x00 0x00 0x00 0x00 0x00 0x00
0x00000ba8: 0x00 0x00 0x00 0x00 0x00 0x00 0x00 0x00
0x00000bb0: 0x00 0x00 0x00 0x00 0x00 0x00 0x00 0x00
0x00000bb8: 0x00 0x00 0x00 0x00 0x00 0x00 0x00 0x00
0x00000bc0: 0x00 0x00 0x00 0x00 0x00 0x00 0x00 0x00
0x00000bc8: 0x00 0x00 0x00 0x00 0x00 0x00 0x00 0x00
0x00000bd0: 0x00 0x00 0x00 0x00 0x00 0x00 0x00 0x00
0x00000bd8: 0x00 0x00 0x00 0x00 0x00 0x00 0x00 0x00
0x00000be0: 0x00 0x00 0x00 0x00 0x00 0x00 0x00 0x00
0x00000be8: 0x00 0x00 0x00 0x00 0x00 0x00 0x00 0x00
0x00000bf0: 0x00 0x00 0x00 0x00 0x00 0x00 0x00 0x00
0x00000bf8: 0x00 0x00 0x00 0x00 0x00 0x00 0x00 0x00
0x00000c00: 0x00 0x00 0x00 0x00 0x00 0x00 0x00 0x00
0x00000c08: 0x00 0x00 0x00 0x00 0x00 0x00 0x00 0x00
0x00000c10: 0x00 0x00 0x00 0x00 0x00 0x00 0x00 0x00
0x00000c18: 0x00 0x00 0x00 0x00 0x00 0x00 0x00 0x00
0x00000c20: 0x00 0x00 0x00 0x00 0x00 0x00 0x00 0x00
0x00000c28: 0x00 0x00 0x00 0x00 0x00 0x00 0x00 0x00
0x00000c30: 0x00 0x00 0x00 0x00 0x00 0x00 0x00 0x00
0x00000c38: 0x00 0x00 0x00 0x00 0x00 0x00 0x00 0x00
0x00000c40: 0x00 0x00 0x00 0x00 0x00 0x00 0x00 0x00
0x00000c48: 0x00 0x00 0x00 0x00 0x00 0x00 0x00 0x00
0x00000c50: 0x00 0x00 0x00 0x00 0x00 0x00 0x00 0x00
0x00000c58: 0x00 0x00 0x00 0x00 0x00 0x00 0x00 0x00
0x00000c60: 0x00 0x00 0x00 0x00 0x00 0x00 0x00 0x00
0x00000c68: 0x00 0x00 0x00 0x00 0x00 0x00 0x00 0x00
0x00000c70: 0x00 0x00 0x00 0x00 0x00 0x00 0x00 0x00
0x00000c78: 0x00 0x00 0x00 0x00 0x00 0x00 0x00 0x00
0x00000c80: 0x00 0x00 0x00 0x00 0x00 0x00 0x00 0x00
0x00000c88: 0x00 0x00 0x00 0x00 0x00 0x00 0x00 0x00
0x00000c90: 0x00 0x00 0x00 0x00 0x00 0x00 0x00 0x00
0x00000c98: 0x00 0x00 0x00 0x00 0x00 0x00 0x00 0x00
0x00000ca0: 0x00 0x00 0x00 0x00 0x00 0x00 0x00 0x00
0x00000ca8: 0x00 0x00 0x00 0x00 0x00 0x00 0x00 0x00
0x00000cb0: 0x00 0x00 0x00 0x00 0x00 0x00 0x00 0x00
0x00000cb8: 0x00 0x00 0x00 0x00 0x00 0x00 0x00 0x00
0x00000cc0: 0x00 0x00 0x00 0x00 0x00 0x00 0x00 0x00
0x00000cc8: 0x00 0x00 0x00 0x00 0x00 0x00 0x00 0x00
0x00000cd0: 0x00 0x00 0x00 0x00 0x00 0x00 0x00 0x00
0x00000cd8: 0x00 0x00 0x00 0x00 0x00 0x00 0x00 0x00
0x00000ce0: 0x00 0x00 0x00 0x00 0x00 0x00 0x00 0x00
0x00000ce8: 0x00 0x00 0x00 0x00 0x00 0x00 0x00 0x00
0x00000cf0: 0x00 0x00 0x00 0x00 0x00 0x00 0x00 0x00
0x00000cf8: 0x00 0x00 0x00 0x00 0x00 0x00 0x00 0x00
0x00000d00: 0x00 0x00 0x00 0x00 0x00 0x00 0x00 0x00
0x00000d08: 0x00 0x00 0x00 0x00 0x00 0x00 0x00 0x00
0x00000d10: 0x00 0x00 0x00 0x00 0x00 0x00 0x00 0x00
0x00000d18: 0x00 0x00 0x00 0x00 0x00 0x00 0x00 0x00
0x00000d20: 0x00 0x00 0x00 0x00 0x00 0x00 0x00 0x00
0x00000d28: 0x00 0x00 0x00 0x00 0x00 0x00 0x00 0x00
0x00000d30: 0x00 0x00 0x00 0x00 0x00 0x00 0x00 0x00
0x00000d38: 0x00 0x00 0x00 0x00 0x00 0x00 0x00 0x00
0x00000d40: 0x00 0x00 0x00 0x00 0x00 0x00 0x00 0x00
0x00000d48: 0x00 0x00 0x00 0x00 0x00 0x00 0x00 0x00
0x00000d50: 0x00 0x00 0x00 0x00 0x00 0x00 0x00 0x00
0x00000d58: 0x00 0x00 0x00 0x00 0x00 0x00 0x00 0x00
0x00000d60: 0x00 0x00 0x00 0x00 0x00 0x00 0x00 0x00
0x00000d68: 0x00 0x00 0x00 0x00 0x00 0x00 0x00 0x00
0x00000d70: 0x00 0x00 0x00 0x00 0x00 0x00 0x00 0x00
0x00000d78: 0x00 0x00 0x00 0x00 0x00 0x00 0x00 0x00
0x00000d80: 0x00 0x00 0x00 0x00 0x00 0x00 0x00 0x00
0x00000d88: 0x00 0x00 0x00 0x00 0x00 0x00 0x00 0x00
0x00000d90: 0x00 0x00 0x00 0x00 0x00 0x00 0x00 0x00
0x00000d98: 0x00 0x00 0x00 0x00 0x00 0x00 0x00 0x00
0x00000da0: 0x00 0x00 0x00 0x00 0x00 0x00 0x00 0x00
0x00000da8: 0x00 0x00 0x00 0x00 0x00 0x00 0x00 0x00
0x00000db0: 0x00 0x00 0x00 0x00 0x00 0x00 0x00 0x00
0x00000db8: 0x00 0x00 0x00 0x00 0x00 0x00 0x00 0x00
0x00000dc0: 0x00 0x00 0x00 0x00 0x00 0x00 0x00 0x00
0x00000dc8: 0x00 0x00 0x00 0x00 0x00 0x00 0x00 0x00
0x00000dd0: 0x00 0x00 0x00 0x00 0x00 0x00 0x00 0x00
0x00000dd8: 0x00 0x00 0x00 0x00 0x00 0x00 0x00 0x00
0x00000de0: 0x00 0x00 0x00 0x00 0x00 0x00 0x00 0x00
0x00000de8: 0x00 0x00 0x00 0x00 0x00 0x00 0x00 0x00
0x00000df0: 0x00 0x00 0x00 0x00 0x00 0x00 0x00 0x00
0x00000df8: 0x00 0x00 0x00 0x00 0x00 0x00 0x00 0x00
0x00000e00: 0x00 0x00 0x00 0x00 0x00 0x00 0x00 0x00
0x00000e08: 0x00 0x00 0x00 0x00 0x00 0x00 0x00 0x00
0x00000e10: 0x00 0x00 0x00 0x00 0x00 0x00 0x00 0x00
0x00000e18: 0x00 0x00 0x00 0x00 0x00 0x00 0x00 0x00
0x00000e20: 0x00 0x00 0x00 0x00 0x00 0x00 0x00 0x00
0x00000e28: 0x00 0x00 0x00 0x00 0x00 0x00 0x00 0x00
0x00000e30: 0x00 0x00 0x00 0x00 0x00 0x00 0x00 0x00
0x00000e38: 0x00 0x00 0x00 0x00 0x00 0x00 0x00 0x00
0x00000e40: 0x00 0x00 0x00 0x00 0x00 0x00 0x00 0x00
0x00000e48: 0x00 0x00 0x00 0x00 0x00 0x00 0x00 0x00
0x00000e50: 0x00 0x00 0x00 0x00 0x00 0x00 0x00 0x00
0x00000e58: 0x00 0x00 0x00 0x00 0x00 0x00 0x00 0x00
0x00000e60: 0x00 0x00 0x00 0x00 0x00 0x00 0x00 0x00
0x00000e68: 0x00 0x00 0x00 0x00 0x00 0x00 0x00 0x00
0x00000e70: 0x00 0x00 0x00 0x00 0x00 0x00 0x00 0x00
0x00000e78: 0x00 0x00 0x00 0x00 0x00 0x00 0x00 0x00
0x00000e80: 0x00 0x00 0x00 0x00 0x00 0x00 0x00 0x00
0x00000e88: 0x00 0x00 0x00 0x00 0x00 0x00 0x00 0x00
0x00000e90: 0x00 0x00 0x00 0x00 0x00 0x00 0x00 0x00
0x00000e98: 0x00 0x00 0x00 0x00 0x00 0x00 0x00 0x00
0x00000ea0: 0x00 0x00 0x00 0x00 0x00 0x00 0x00 0x00
0x00000ea8: 0x00 0x00 0x00 0x00 0x00 0x00 0x00 0x00
0x00000eb0: 0x00 0x00 0x00 0x00 0x00 0x00 0x00 0x00
0x00000eb8: 0x00 0x00 0x00 0x00 0x00 0x00 0x00 0x00
0x00000ec0: 0x00 0x00 0x00 0x00 0x00 0x00 0x00 0x00
0x00000ec8: 0x00 0x00 0x00 0x00 0x00 0x00 0x00 0x00
0x00000ed0: 0x00 0x00 0x00 0x00 0x00 0x00 0x00 0x00
0x00000ed8: 0x00 0x00 0x00 0x00 0x00 0x00 0x00 0x00
0x00000ee0: 0x00 0x00 0x00 0x00 0x00 0x00 0x00 0x00
0x00000ee8: 0x00 0x00 0x00 0x00 0x00 0x00 0x00 0x00
0x00000ef0: 0x00 0x00 0x00 0x00 0x00 0x00 0x00 0x00
0x00000ef8: 0x00 0x00 0x00 0x00 0x00 0x00 0x00 0x00
0x00000f00: 0x00 0x00 0x00 0x00 0x00 0x00 0x00 0x00
0x00000f08: 0x00 0x00 0x00 0x00 0x00 0x00 0x00 0x00
0x00000f10: 0x00 0x00 0x00 0x00 0x00 0x00 0x00 0x00
0x00000f18: 0x00 0x00 0x00 0x00 0x00 0x00 0x00 0x00
0x00000f20: 0x00 0x00 0x00 0x00 0x00 0x00 0x00 0x00
0x00000f28: 0x00 0x00 0x00 0x00 0x00 0x00 0x00 0x00
0x00000f30: 0x00 0x00 0x00 0x00 0x00 0x00 0x00 0x00
0x00000f38: 0x00 0x00 0x00 0x00 0x00 0x00 0x00 0x00
0x00000f40: 0x00 0x00 0x00 0x00 0x00 0x00 0x00 0x00
0x00000f48: 0x00 0x00 0x00 0x00 0x00 0x00 0x00 0x00
0x00000f50: 0x00 0x00 0x00 0x00 0x00 0x00 0x00 0x00
0x00000f58: 0x00 0x00 0x00 0x00 0x00 0x00 0x00 0x00
0x00000f60: 0x00 0x00 0x00 0x00 0x00 0x00 0x00 0x00
0x00000f68: 0x00 0x00 0x00 0x00 0x00 0x00 0x00 0x00
0x00000f70: 0x00 0x00 0x00 0x00 0x00 0x00 0x00 0x00
0x00000f78: 0x00 0x00 0x00 0x00 0x00 0x00 0x00 0x00
0x00000f80: 0x00 0x00 0x00 0x00 0x00 0x00 0x00 0x00
0x00000f88: 0x00 0x00 0x00 0x00 0x00 0x00 0x00 0x00
0x00000f90: 0x00 0x00 0x00 0x00 0x00 0x00 0x00 0x00
0x00000f98: 0x00 0x00 0x00 0x00 0x00 0x00 0x00 0x00
0x00000fa0: 0x00 0x00 0x00 0x00 0x00 0x00 0x00 0x00
0x00000fa8: 0x00 0x00 0x00 0x00 0x00 0x00 0x00 0x00
0x00000fb0: 0x00 0x00 0x00 0x00 0x00 0x00 0x00 0x00
0x00000fb8: 0x00 0x00 0x00 0x00 0x00 0x00 0x00 0x00
0x00000fc0: 0x00 0x00 0x00 0x00 0x00 0x00 0x00 0x00
0x00000fc8: 0x00 0x00 0x00 0x00 0x00 0x00 0x00 0x00
0x00000fd0: 0x00 0x00 0x00 0x00 0x00 0x00 0x00 0x00
0x00000fd8: 0x00 0x00 0x00 0x00 0x00 0x00 0x00 0x00
0x00000fe0: 0x00 0x00 0x00 0x00 0x00 0x00 0x00 0x00
0x00000fe8: 0x00 0x00 0x00 0x00 0x00 0x00 0x00 0x00
0x00000ff0: 0x00 0x00 0x00 0x00 0x00 0x00 0x00 0x00
0x00000ff8: 0x00 0x00 0x00 0x00 0x00 0x00 0x00 0x00
0x00001000: 0x00 0x00 0x00 0x00 0x00 0x00 0x00 0x00
0x00001008: 0x00 0x00 0x00 0x00 0x00 0x00 0x00 0x00
0x00001010: 0x00 0x00 0x00 0x00 0x00 0x00 0x00 0x00
0x00001018: 0x00 0x00 0x00 0x00 0x00 0x00 0x00 0x00
0x00001020: 0x00 0x00 0x00 0x00 0x00 0x00 0x00 0x00
0x00001028: 0x00 0x00 0x00 0x00 0x00 0x00 0x00 0x00
0x00001030: 0x00 0x00 0x00 0x00 0x00 0x00 0x00 0x00
0x00001038: 0x00 0x00 0x00 0x00 0x00 0x00 0x00 0x00
0x00001040: 0x00 0x00 0x00 0x00 0x00 0x00 0x00 0x00
0x00001048: 0x00 0x00 0x00 0x00 0x00 0x00 0x00 0x00
0x00001050: 0x00 0x00 0x00 0x00 0x00 0x00 0x00 0x00
0x00001058: 0x00 0x00 0x00 0x00 0x00 0x00 0x00 0x00
0x00001060: 0x00 0x00 0x00 0x00 0x00 0x00 0x00 0x00
0x00001068: 0x00 0x00 0x00 0x00 0x00 0x00 0x00 0x00
0x00001070: 0x00 0x00 0x00 0x00 0x00 0x00 0x00 0x00
0x00001078: 0x00 0x00 0x00 0x00 0x00 0x00 0x00 0x00
0x00001080: 0x00 0x00 0x00 0x00 0x00 0x00 0x00 0x00
0x00001088: 0x00 0x00 0x00 0x00 0x00 0x00 0x00 0x00
0x00001090: 0x00 0x00 0x00 0x00 0x00 0x00 0x00 0x00
0x00001098: 0x00 0x00 0x00 0x00 0x00 0x00 0x00 0x00
0x000010a0: 0x00 0x00 0x00 0x00 0x00 0x00 0x00 0x00
0x000010a8: 0x00 0x00 0x00 0x00 0x00 0x00 0x00 0x00
0x000010b0: 0x00 0x00 0x00 0x00 0x00 0x00 0x00 0x00
0x000010b8: 0x00 0x00 0x00 0x00 0x00 0x00 0x00 0x00
0x000010c0: 0x00 0x00 0x00 0x00 0x00 0x00 0x00 0x00
0x000010c8: 0x00 0x00 0x00 0x00 0x00 0x00 0x00 0x00
0x000010d0: 0x00 0x00 0x00 0x00 0x00 0x00 0x00 0x00
0x000010d8: 0x00 0x00 0x00 0x00 0x00 0x00 0x00 0x00
0x000010e0: 0x00 0x00 0x00 0x00 0x00 0x00 0x00 0x00
0x000010e8: 0x00 0x00 0x00 0x00 0x00 0x00 0x00 0x00
0x000010f0: 0x00 0x00 0x00 0x00 0x00 0x00 0x00 0x00
0x000010f8: 0x00 0x00 0x00 0x00 0x00 0x00 0x00 0x00
0x00001100: 0x00 0x00 0x00 0x00 0x00 0x00 0x00 0x00
0x00001108: 0x00 0x00 0x00 0x00 0x00 0x00 0x00 0x00
0x00001110: 0x00 0x00 0x00 0x00 0x00 0x00 0x00 0x00
0x00001118: 0x00 0x00 0x00 0x00 0x00 0x00 0x00 0x00
0x00001120: 0x00 0x00 0x00 0x00 0x00 0x00 0x00 0x00
0x00001128: 0x00 0x00 0x00 0x00 0x00 0x00 0x00 0x00
0x00001130: 0x00 0x00 0x00 0x00 0x00 0x00 0x00 0x00
0x00001138: 0x00 0x00 0x00 0x00 0x00 0x00 0x00 0x00
0x00001140: 0x00 0x00 0x00 0x00 0x00 0x00 0x00 0x00
0x00001148: 0x00 0x00 0x00 0x00 0x00 0x00 0x00 0x00
0x00001150: 0x00 0x00 0x00 0x00 0x00 0x00 0x00 0x00
0x00001158: 0x00 0x00 0x00 0x00 0x00 0x00 0x00 0x00
0x00001160: 0x00 0x00 0x00 0x00 0x00 0x00 0x00 0x00
0x00001168: 0x00 0x00 0x00 0x00 0x00 0x00 0x00 0x00
0x00001170: 0x00 0x00 0x00 0x00 0x00 0x00 0x00 0x00
0x00001178: 0x00 0x00 0x00 0x00 0x00 0x00 0x00 0x00
0x00001180: 0x00 0x00 0x00 0x00 0x00 0x00 0x00 0x00
0x00001188: 0x00 0x00 0x00 0x00 0x00 0x00 0x00 0x00
0x00001190: 0x00 0x00 0x00 0x00 0x00 0x00 0x00 0x00
0x00001198: 0x00 0x00 0x00 0x00 0x00 0x00 0x00 0x00
0x000011a0: 0x00 0x00 0x00 0x00 0x00 0x00 0x00 0x00
0x000011a8: 0x00 0x00 0x00 0x00 0x00 0x00 0x00 0x00
0x000011b0: 0x00 0x00 0x00 0x00 0x00 0x00 0x00 0x00
0x000011b8: 0x00 0x00 0x00 0x00 0x00 0x00 0x00 0x00
0x000011c0: 0x00 0x00 0x00 0x00 0x00 0x00 0x00 0x00
0x000011c8: 0x00 0x00 0x00 0x00 0x00 0x00 0x00 0x00
0x000011d0: 0x00 0x00 0x00 0x00 0x00 0x00 0x00 0x00
0x000011d8: 0x00 0x00 0x00 0x00 0x00 0x00 0x00 0x00
0x000011e0: 0x00 0x00 0x00 0x00 0x00 0x00 0x00 0x00
0x000011e8: 0x00 0x00 0x00 0x00 0x00 0x00 0x00 0x00
0x000011f0: 0x00 0x00 0x00 0x00 0x00 0x00 0x00 0x00
0x000011f8: 0x00 0x00 0x00 0x00 0x00 0x00 0x00 0x00
0x00001200: 0x00 0x00 0x00 0x00 0x00 0x00 0x00 0x00
0x00001208: 0x00 0x00 0x00 0x00 0x00 0x00 0x00 0x00
0x00001210: 0x00 0x00 0x00 0x00 0x00 0x00 0x00 0x00
0x00001218: 0x00 0x00 0x00 0x00 0x00 0x00 0x00 0x00
0x00001220: 0x00 0x00 0x00 0x00 0x00 0x00 0x00 0x00
0x00001228: 0x00 0x00 0x00 0x00 0x00 0x00 0x00 0x00
0x00001230: 0x00 0x00 0x00 0x00 0x00 0x00 0x00 0x00
0x00001238: 0x00 0x00 0x00 0x00 0x00 0x00 0x00 0x00
0x00001240: 0x00 0x00 0x00 0x00 0x00 0x00 0x00 0x00
0x00001248: 0x00 0x00 0x00 0x00 0x00 0x00 0x00 0x00
0x00001250: 0x00 0x00 0x00 0x00 0x00 0x00 0x00 0x00
0x00001258: 0x00 0x00 0x00 0x00 0x00 0x00 0x00 0x00
0x00001260: 0x00 0x00 0x00 0x00 0x00 0x00 0x00 0x00
0x00001268: 0x00 0x00 0x00 0x00 0x00 0x00 0x00 0x00
0x00001270: 0x00 0x00 0x00 0x00 0x00 0x00 0x00 0x00
0x00001278: 0x00 0x00 0x00 0x00 0x00 0x00 0x00 0x00
0x00001280: 0x00 0x00 0x00 0x00 0x00 0x00 0x00 0x00
0x00001288: 0x00 0x00 0x00 0x00 0x00 0x00 0x00 0x00
0x00001290: 0x00 0x00 0x00 0x00 0x00 0x00 0x00 0x00
0x00001298: 0x00 0x00 0x00 0x00 0x00 0x00 0x00 0x00
0x000012a0: 0x00 0x00 0x00 0x00 0x00 0x00 0x00 0x00
0x000012a8: 0x00 0x00 0x00 0x00 0x00 0x00 0x00 0x00
0x000012b0: 0x00 0x00 0x00 0x00 0x00 0x00 0x00 0x00
0x000012b8: 0x00 0x00 0x00 0x00 0x00 0x00 0x00 0x00
0x000012c0: 0x00 0x00 0x00 0x00 0x00 0x00 0x00 0x00
0x000012c8: 0x00 0x00 0x00 0x00 0x00 0x00 0x00 0x00
0x000012d0: 0x00 0x00 0x00 0x00 0x00 0x00 0x00 0x00
0x000012d8: 0x00 0x00 0x00 0x00 0x00 0x00 0x00 0x00
0x000012e0: 0x00 0x00 0x00 0x00 0x00 0x00 0x00 0x00
0x000012e8: 0x00 0x00 0x00 0x00 0x00 0x00 0x00 0x00
0x000012f0: 0x00 0x00 0x00 0x00 0x00 0x00 0x00 0x00
0x000012f8: 0x00 0x00 0x00 0x00 0x00 0x00 0x00 0x00
0x00001300: 0x00 0x00 0x00 0x00 0x00 0x00 0x00 0x00
0x00001308: 0x00 0x00 0x00 0x00 0x00 0x00 0x00 0x00
0x00001310: 0x00 0x00 0x00 0x00 0x00 0x00 0x00 0x00
0x00001318: 0x00 0x00 0x00 0x00 0x00 0x00 0x00 0x00
0x00001320: 0x00 0x00 0x00 0x00 0x00 0x00 0x00 0x00
0x00001328: 0x00 0x00 0x00 0x00 0x00 0x00 0x00 0x00
0x00001330: 0x00 0x00 0x00 0x00 0x00 0x00 0x00 0x00
0x00001338: 0x00 0x00 0x00 0x00 0x00 0x00 0x00 0x00
0x00001340: 0x00 0x00 0x00 0x00 0x00 0x00 0x00 0x00
0x00001348: 0x00 0x00 0x00 0x00 0x00 0x00 0x00 0x00
0x00001350: 0x00 0x00 0x00 0x00 0x00 0x00 0x00 0x00
0x00001358: 0x00 0x00 0x00 0x00 0x00 0x00 0x00 0x00
0x00001360: 0x00 0x00 0x00 0x00 0x00 0x00 0x00 0x00
0x00001368: 0x00 0x00 0x00 0x00 0x00 0x00 0x00 0x00
0x00001370: 0x00 0x00 0x00 0x00 0x00 0x00 0x00 0x00
0x00001378: 0x00 0x00 0x00 0x00 0x00 0x00 0x00 0x00
0x00001380: 0x00 0x00 0x00 0x00 0x00 0x00 0x00 0x00
0x00001388: 0x00 0x00 0x00 0x00 0x00 0x00 0x00 0x00
0x00001390: 0x00 0x00 0x00 0x00 0x00 0x00 0x00 0x00
0x00001398: 0x00 0x00 0x00 0x00 0x00 0x00 0x00 0x00
0x000013a0: 0x00 0x00 0x00 0x00 0x00 0x00 0x00 0x00
0x000013a8: 0x00 0x00 0x00 0x00 0x00 0x00 0x00 0x00
0x000013b0: 0x00 0x00 0x00 0x00 0x00 0x00 0x00 0x00
0x000013b8: 0x00 0x00 0x00 0x00 0x00 0x00 0x00 0x00
0x000013c0: 0x00 0x00 0x00 0x00 0x00 0x00 0x00 0x00
0x000013c8: 0x00 0x00 0x00 0x00 0x00 0x00 0x00 0x00
0x000013d0: 0x00 0x00 0x00 0x00 0x00 0x00 0x00 0x00
0x000013d8: 0x00 0x00 0x00 0x00 0x00 0x00 0x00 0x00
0x000013e0: 0x00 0x00 0x00 0x00 0x00 0x00 0x00 0x00
0x000013e8: 0x00 0x00 0x00 0x00 0x00 0x00 0x00 0x00
0x000013f0: 0x00 0x00 0x00 0x00 0x00 0x00 0x00 0x00
0x000013f8: 0x00 0x00 0x00 0x00 0x00 0x00 0x00 0x00
0x00001400: 0x00 0x00 0x00 0x00 0x00 0x00 0x00 0x00
0x00001408: 0x00 0x00 0x00 0x00 0x00 0x00 0x00 0x00
0x00001410: 0x00 0x00 0x00 0x00 0x00 0x00 0x00 0x00
0x00001418: 0x00 0x00 0x00 0x00 0x00 0x00 0x00 0x00
0x00001420: 0x00 0x00 0x00 0x00 0x00 0x00 0x00 0x00
0x00001428: 0x00 0x00 0x00 0x00 0x00 0x00 0x00 0x00
0x00001430: 0x00 0x00 0x00 0x00 0x00 0x00 0x00 0x00
0x00001438: 0x00 0x00 0x00 0x00 0x00 0x00 0x00 0x00
0x00001440: 0x00 0x00 0x00 0x00 0x00 0x00 0x00 0x00
0x00001448: 0x00 0x00 0x00 0x00 0x00 0x00 0x00 0x00
0x00001450: 0x00 0x00 0x00 0x00 0x00 0x00 0x00 0x00
0x00001458: 0x00 0x00 0x00 0x00 0x00 0x00 0x00 0x00
0x00001460: 0x00 0x00 0x00 0x00 0x00 0x00 0x00 0x00
0x00001468: 0x00 0x00 0x00 0x00 0x00 0x00 0x00 0x00
0x00001470: 0x00 0x00 0x00 0x00 0x00 0x00 0x00 0x00
0x00001478: 0x00 0x00 0x00 0x00 0x00 0x00 0x00 0x00
0x00001480: 0x00 0x00 0x00 0x00 0x00 0x00 0x00 0x00
0x00001488: 0x00 0x00 0x00 0x00 0x00 0x00 0x00 0x00
0x00001490: 0x00 0x00 0x00 0x00 0x00 0x00 0x00 0x00
0x00001498: 0x00 0x00 0x00 0x00 0x00 0x00 0x00 0x00
0x000014a0: 0x00 0x00 0x00 0x00 0x00 0x00 0x00 0x00
0x000014a8: 0x00 0x00 0x00 0x00 0x00 0x00 0x00 0x00
0x000014b0: 0x00 0x00 0x00 0x00 0x00 0x00 0x00 0x00
0x000014b8: 0x00 0x00 0x00 0x00 0x00 0x00 0x00 0x00
0x000014c0: 0x00 0x00 0x00 0x00 0x00 0x00 0x00 0x00
0x000014c8: 0x00 0x00 0x00 0x00 0x00 0x00 0x00 0x00
0x000014d0: 0x00 0x00 0x00 0x00 0x00 0x00 0x00 0x00
0x000014d8: 0x00 0x00 0x00 0x00 0x00 0x00 0x00 0x00
0x000014e0: 0x00 0x00 0x00 0x00 0x00 0x00 0x00 0x00
0x000014e8: 0x00 0x00 0x00 0x00 0x00 0x00 0x00 0x00
0x000014f0: 0x00 0x00 0x00 0x00 0x00 0x00 0x00 0x00
0x000014f8: 0x00 0x00 0x00 0x00 0x00 0x00 0x00 0x00
0x00001500: 0x00 0x00 0x00 0x00 0x00 0x00 0x00 0x00
0x00001508: 0x00 0x00 0x00 0x00 0x00 0x00 0x00 0x00
0x00001510: 0x00 0x00 0x00 0x00 0x00 0x00 0x00 0x00
0x00001518: 0x00 0x00 0x00 0x00 0x00 0x00 0x00 0x00
0x00001520: 0x00 0x00 0x00 0x00 0x00 0x00 0x00 0x00
0x00001528: 0x00 0x00 0x00 0x00 0x00 0x00 0x00 0x00
0x00001530: 0x00 0x00 0x00 0x00 0x00 0x00 0x00 0x00
0x00001538: 0x00 0x00 0x00 0x00 0x00 0x00 0x00 0x00
0x00001540: 0x00 0x00 0x00 0x00 0x00 0x00 0x00 0x00
0x00001548: 0x00 0x00 0x00 0x00 0x00 0x00 0x00 0x00
0x00001550: 0x00 0x00 0x00 0x00 0x00 0x00 0x00 0x00
0x00001558: 0x00 0x00 0x00 0x00 0x00 0x00 0x00 0x00
0x00001560: 0x00 0x00 0x00 0x00 0x00 0x00 0x00 0x00
0x00001568: 0x00 0x00 0x00 0x00 0x00 0x00 0x00 0x00
0x00001570: 0x00 0x00 0x00 0x00 0x00 0x00 0x00 0x00
0x00001578: 0x00 0x00 0x00 0x00 0x00 0x00 0x00 0x00
0x00001580: 0x00 0x00 0x00 0x00 0x00 0x00 0x00 0x00
0x00001588: 0x00 0x00 0x00 0x00 0x00 0x00 0x00 0x00
0x00001590: 0x00 0x00 0x00 0x00 0x00 0x00 0x00 0x00
0x00001598: 0x00 0x00 0x00 0x00 0x00 0x00 0x00 0x00
0x000015a0: 0x00 0x00 0x00 0x00 0x00 0x00 0x00 0x00
0x000015a8: 0x00 0x00 0x00 0x00 0x00 0x00 0x00 0x00
0x000015b0: 0x00 0x00 0x00 0x00 0x00 0x00 0x00 0x00
0x000015b8: 0x00 0x00 0x00 0x00 0x00 0x00 0x00 0x00
0x000015c0: 0x00 0x00 0x00 0x00 0x00 0x00 0x00 0x00
0x000015c8: 0x00 0x00 0x00 0x00 0x00 0x00 0x00 0x00
0x000015d0: 0x00 0x00 0x00 0x00 0x00 0x00 0x00 0x00
0x000015d8: 0x00 0x00 0x00 0x00 0x00 0x00 0x00 0x00
0x000015e0: 0x00 0x00 0x00 0x00 0x00 0x00 0x00 0x00
0x000015e8: 0x00 0x00 0x00 0x00 0x00 0x00 0x00 0x00
0x000015f0: 0x00 0x00 0x00 0x00 0x00 0x00 0x00 0x00
0x000015f8: 0x00 0x00 0x00 0x00 0x00 0x00 0x00 0x00
0x00001600: 0x00 0x00 0x00 0x00 0x00 0x00 0x00 0x00
0x00001608: 0x00 0x00 0x00 0x00 0x00 0x00 0x00 0x00
0x00001610: 0x00 0x00 0x00 0x00 0x00 0x00 0x00 0x00
0x00001618: 0x00 0x00 0x00 0x00 0x00 0x00 0x00 0x00
0x00001620: 0x00 0x00 0x00 0x00 0x00 0x00 0x00 0x00
0x00001628: 0x00 0x00 0x00 0x00 0x00 0x00 0x00 0x00
0x00001630: 0x00 0x00 0x00 0x00 0x00 0x00 0x00 0x00
0x00001638: 0x00 0x00 0x00 0x00 0x00 0x00 0x00 0x00
0x00001640: 0x00 0x00 0x00 0x00 0x00 0x00 0x00 0x00
0x00001648: 0x00 0x00 0x00 0x00 0x00 0x00 0x00 0x00
0x00001650: 0x00 0x00 0x00 0x00 0x00 0x00 0x00 0x00
0x00001658: 0x00 0x00 0x00 0x00 0x00 0x00 0x00 0x00
0x00001660: 0x00 0x00 0x00 0x00 0x00 0x00 0x00 0x00
0x00001668: 0x00 0x00 0x00 0x00 0x00 0x00 0x00 0x00
0x00001670: 0x00 0x00 0x00 0x00 0x00 0x00 0x00 0x00
0x00001678: 0x00 0x00 0x00 0x00 0x00 0x00 0x00 0x00
0x00001680: 0x00 0x00 0x00 0x00 0x00 0x00 0x00 0x00
0x00001688: 0x00 0x00 0x00 0x00 0x00 0x00 0x00 0x00
0x00001690: 0x00 0x00 0x00 0x00 0x00 0x00 0x00 0x00
0x00001698: 0x00 0x00 0x00 0x00 0x00 0x00 0x00 0x00
0x000016a0: 0x00 0x00 0x00 0x00 0x00 0x00 0x00 0x00
0x000016a8: 0x00 0x00 0x00 0x00 0x00 0x00 0x00 0x00
0x000016b0: 0x00 0x00 0x00 0x00 0x00 0x00 0x00 0x00
0x000016b8: 0x00 0x00 0x00 0x00 0x00 0x00 0x00 0x00
0x000016c0: 0x00 0x00 0x00 0x00 0x00 0x00 0x00 0x00
0x000016c8: 0x00 0x00 0x00 0x00 0x00 0x00 0x00 0x00
0x000016d0: 0x00 0x00 0x00 0xff 0x11 0xee 0x00 0x00
0x000016d8: 0x33 0xcc 0x44 0xbb 0x00 0x00 0x00 0x00
0x000016e0: 0x00 0x00 0x00 0x00 0x57 0x01 0x98 0x12
0x000016e8: 0x00 0x00 0x00 0x00 0x00 0x00 0x00 0x00
0x000016f0: 0x00 0x00 0x00 0x00 0x00 0x00 0x00 0x00
0x000016f8: 0x00 0x00 0x00 0x00 0x00 0x00 0x00 0x00
0x00001700: (read error 5) (read error 5) (read error 5) (read error 5) (read error 5) (read error 5) (read error 5) (read error 5)
0x00001708: (read error 5) (read error 5) (read error 5) (read error 5) (read error 5) (read error 5) (read error 5) (read error 5)
... continues with errors until 0x10000 ...

The Block 0x0000 until 0x16ff is repeated at 0x10000. It is probably also
repeated at 0x20000, 0x30000 and higher, but it is not tested.
